datetime,summary,keywords
2024-09-12,"Samsung Electronics stock hit a 52-week low with a 14.7% drop over a month due to global economic slowdown, falling DRAM prices, and weak smartphone/PC demand. Foreign and institutional investors sold shares; retail investors bought. Q3 earnings outlook cut due to semiconductor one-time costs and inventory adjustments. AI and data center memory demand (DDR5, HBM) remains strong, supporting potential Q4 rebound. Insider buying signals confidence amid macro risks.","Samsung Electronics, stock decline, 52-week low, foreign sell-off, retail buying, Q3 earnings downgrade, target price cut, DRAM price drop, smartphone and PC demand slowdown, semiconductor costs, inventory adjustment, AI demand, DDR5, HBM, insider buying, economic uncertainty"
2024-09-19,"Samsung Electronics stock fell over 26% since July due to weak Q3 earnings outlook, sluggish smartphone and PC demand, falling memory prices, and US export restrictions on HBM to China. Foreign investors sold shares worth over 7 trillion KRW, while insiders bought stock to support price. Price targets lowered by 17%. Upcoming Samsung and Micron earnings may impact near-term movement.","Samsung Electronics, stock decline, Q3 earnings downgrade, smartphone demand slump, memory price drop, foreign selling, insider buying, price target cut, US export restrictions, HBM, market volatility, investment opportunity, Micron earnings"
2024-09-26,"Samsung Electronics stock fell below 60,000 KRW after 19 months amid semiconductor downturn fears. Downgrades from Macquarie and Morgan Stanley, falling DRAM/NAND prices, delayed HBM shipments to Nvidia, and lagging behind SK Hynix and TSMC pressured shares. Samsung is cutting costs with global layoffs and lowered Q3 earnings forecasts.","Samsung Electronics, stock decline, semiconductor downturn, DRAM, NAND, HBM delay, Nvidia, SK Hynix, TSMC, downgrades, layoffs, cost-cutting, Q3 earnings downgrade, 52-week low"
2024-10-03,"Samsung Electronics stock fell nearly 18% to a 1-year low due to heavy foreign selling (~10 trillion KRW). Concerns include HBM competitiveness, weak Q3 earnings forecast, innovation lag vs SK Hynix, and challenges in semiconductor and foundry divisions. Recovery depends on securing AI contracts like Nvidia Blackwell.","Samsung Electronics, stock decline, foreign selling, 1-year low, HBM competitiveness, Q3 earnings, innovation lag, SK Hynix, semiconductor division, foundry, AI contracts, Nvidia Blackwell, structural reform"
2024-10-10,"Samsung Electronics stock hit 52-week lows near 58,900 KRW due to weak Q3 earnings and missed expectations. Foreign investors sold aggressively; retail investors bought seeing undervaluation with P/E and P/B below 1. Concerns include HBM competitiveness, foundry challenges, SK Hynix and Chinese competition. Recovery depends on AI contracts and supply fixes.","Samsung Electronics, stock decline, 52-week low, Q3 miss, foreign selling, retail buying, low P/E, low P/B, HBM, foundry issues, SK Hynix, AI demand, Nvidia Blackwell, structural reform, earnings outlook, competition, target price cuts"
2024-10-17,"Samsung Electronics faces downward pressure with target prices cut from ~100,000 to ~90,000 KRW while trading near 57,700 KRW. Weak HBM and legacy memory performance, foreign selling, SK Hynix and Chinese competition, plus labor issues weigh on valuation. Gradual semiconductor recovery expected with key support near 54,000 KRW.","Samsung Electronics, target price cut, stock decline, HBM weakness, legacy memory, SK Hynix, foreign selling, labor issues, talent outflow, AI semiconductor, Nvidia collaboration, valuation, price support, semiconductor recovery"
2024-10-24,"Samsung Electronics stock rebounded nearly 4% as foreign investors ended a 34-day selling streak. Despite this, the stock dropped from 70,000 to 50,000 KRW due to weak semiconductor demand, AI memory underperformance, and competition from SK Hynix and TSMC. Structural challenges include tech gaps and declining memory demand. Analysts highlight potential recovery via reforms, new HBM tech, and R&D, making current valuation a medium- to long-term buying opportunity.","Samsung Electronics, stock rebound, foreign buying, semiconductor demand, AI memory, foundry market, SK Hynix, TSMC, HBM, R&D investment, organizational reform, undervaluation, price-to-book, competition"
2024-10-31,"Samsung Electronics stock stagnates near 50,000-60,000 KRW despite strong Q3 earnings growth. Semiconductor profits fell and HBM3E commercialization delays, especially Nvidia supply uncertainty, limit gains. Target price downgrades reflect cautious outlook amid next-gen memory competition. Insider buying signals management confidence.","Samsung Electronics, stock stagnation, Q3 earnings, semiconductor profit decline, HBM3E delay, Nvidia supply, target price downgrade, memory competition, semiconductor demand, insider buying"
2024-11-07,"Samsung Electronics stock hit 52-week lows amid continued foreign selling and weak memory demand. Lagging HBM technology vs. SK Hynix and concerns over CHIPS Act subsidy cuts under Trump add pressure. Recovery depends on improving product quality and closing tech gaps.","Samsung Electronics, stock decline, 52-week low, foreign selling, HBM, SK Hynix, CHIPS Act, Trump, semiconductor market, tech competitiveness, memory slowdown, product quality"
2024-11-14,"Samsung Electronics stock fell below 50,000 KRW and market cap dropped under 300T KRW due to foreign selling driven by HBM technology concerns and weak AI chip competitiveness. SK Hynix’s HBM3E progress highlights Samsung’s delays. Rising U.S. yields, trade war risk, and capital outflows worsen sentiment.","Samsung Electronics, stock decline, foreign selling, HBM gap, AI chips, SK Hynix, HBM3E, organizational delays, U.S. yields, trade war, capital outflow, KOSPI, semiconductor sector"
2024-11-21,"Samsung Electronics stock shows high volatility driven by progress in HBM supply to Nvidia, with CEO Jensen Huang’s remarks fueling optimism for AI chip leadership. A 10T KRW share buyback was announced to stabilize the stock amid inheritance tax-related selling by the Samsung family and margin call risks. Sentiment hinges on Nvidia supply success and foreign investment trends.","Samsung Electronics, stock volatility, HBM, Nvidia, Jensen Huang, AI chips, inheritance tax, share buyback, margin call, Samsung family, stock stabilization, foreign investors"
2024-11-28,"Samsung Electronics experiences short-term volatility due to HBM concerns and geopolitical uncertainty related to the Trump administration and U.S. policy shifts. Despite share buybacks and management changes, stock impact has been limited. Analysts expect recovery and strong earnings in H2 2025 driven by AI demand and Nvidia’s HBM3E launch.","Samsung Electronics, stock volatility, HBM, geopolitical risk, Trump administration, U.S. policy, share buyback, AI demand, Nvidia HBM3E, 2025 earnings, stock recovery, memory, foundry"
2024-12-05,"Samsung Electronics stock stays near 50,000 KRW amid a prolonged semiconductor downturn, weak memory prices, and political risks in South Korea, including leadership uncertainty. Earnings downgrades and target price cuts by major brokers reflect pressure from CXMT competition and HBM export restrictions tied to U.S.-China tensions. Despite foreign selling, downside appears limited due to low valuation, large share buyback, and potential U.S. sanctions on rivals.","Samsung Electronics, semiconductor downturn, memory prices, political risk, earnings downgrade, target price cut, CXMT, HBM export, U.S.-China tensions, foreign selling, share buyback, valuation support"
2024-12-12,"Samsung Electronics stock faces pressure from weak semiconductor demand, AI competitiveness concerns, and falling prices. Earnings and target prices for Q4 2024 and 2025 were downgraded due to poor DS and MX division performance and Chinese competition like CXMT. Rebound expected from Q1 2025 on AI demand and valuation recovery, but a clear turnaround is needed.","Samsung Electronics, semiconductors, earnings downgrade, target price cut, AI competitiveness, DS division, MX division, CXMT, Q4 2024, 2025 outlook, price pressure, rebound forecast"
2024-12-19,"Samsung Electronics faces earnings pressure due to weak memory chip demand and price cuts by CXMT and JHICC. Q4 and 2025 earnings forecasts downgraded. Foreign investors sold 10T KRW; retail investors bought on dip. Target price cut by 20%, but 'Buy' ratings maintained. Risks include trade tensions, strong USD/KRW; potential upside from U.S. sanctions and share buybacks.","Samsung Electronics, semiconductors, memory chips, earnings forecast, CXMT, JHICC, foreign selling, retail buying, Q4 downgrade, share buyback, trade risk, USD/KRW, target price cut, oversold"
