datetime,summary,keywords
2024-01-03,"Samsung Electronics is a top 2024 stock pick with expected rebound from DRAM recovery, NAND loss reduction, and AI semiconductor demand; KOSPI and KOSDAQ showed strong 2023 rallies supported by foreign investment and secondary battery stocks, while analysts caution against market pattern reliance.","Samsung Electronics, stock forecast, DRAM recovery, NAND, AI semiconductor, KOSPI, KOSDAQ, foreign investment, secondary battery stocks, market optimism"
2024-01-10,"Samsung Electronics drove South Korea’s 2023 stock market rebound with ₩144 trillion market cap growth, led by strong IT and semiconductor sentiment despite lower Q4 operating profit; family share sales for inheritance tax did not affect top shareholder status.","Samsung Electronics, market cap growth, Q4 earnings, DRAM recovery, NAND loss, semiconductor sector, investor sentiment, inheritance tax, family shareholders"
2024-01-17,"Samsung Electronics’ stock rebounded early 2024, driven by Galaxy S24 AI features, semiconductor momentum, and foreign investor buying amid expected earnings recovery and rising DRAM prices, with target prices up to 95,000 KRW.","Samsung Electronics, Galaxy S24, AI, stock rebound, foreign investors, semiconductor, AI chips, DRAM, earnings recovery, target price, memory market"
2024-01-24,"Samsung SDI faces stock declines from foreign sell-offs, weak Q4 2023 earnings, and EV market slowdown, while Samsung Group deals with legal issues involving Lee Jae-yong and merger/accounting fraud allegations. Despite challenges, analysts see undervaluation due to strong EV demand from clients like BMW and Rivian.","Samsung SDI, Samsung Group, Lee Jae-yong, stock decline, foreign selling, Q4 earnings, EV battery, legal issues, merger fraud, accounting fraud, Samsung C&T, Cheil Industries, Samsung Biologics, BMW, Rivian"
2024-02-06,"Lee Jae-yong, Samsung Electronics Chairman, was acquitted of charges related to illegal management succession, stock manipulation, and accounting fraud in the 2015 Cheil Industries-Samsung C&T merger. The court found no evidence of unfair practices or shareholder harm, reducing legal uncertainty and enabling stronger leadership amid semiconductor market challenges. Corporate governance scrutiny remains.","Samsung Electronics, Lee Jae-yong, acquittal, management succession, Cheil Industries, Samsung C&T merger, stock manipulation, accounting fraud, Samsung BioLogics, court ruling, semiconductor, corporate governance, legal risk"
2024-02-13,"Samsung Electronics attracts strong investor interest from semiconductor leadership, AI, and robotics investments. Post-2018 stock split shares gained accessibility with prices rising and major brokers forecasting growth. Chairman Lee Jae-yong’s acquittal reduces legal risks, enabling aggressive management and easing valuation discounts. Focus on high-value memory, AI integration, and robotics, supported by Rainbow Robotics and CES 2024 commitments, underpins positive growth outlook despite short-term risks.","Samsung Electronics, stock price, stock split, Lee Jae-yong acquittal, semiconductor, AI adoption, robotics, Rainbow Robotics, strategic investment, memory products, CES 2024, Korea discount, legal risk, institutional investment"
2024-02-20,"Samsung Electronics faces competitive pressure from Sony and Toyota in operating profit and market cap. Samsung Securities remains resilient despite Q4 losses with stable dividends and positive ratings. Preferred shares outperform common shares due to higher dividends and strong foreign demand. Samsung commits to returning 50% of free cash flow over three years, boosting long-term investment appeal amid potential memory capex reductions.","Samsung Electronics, Samsung Securities, Sony, Toyota, operating profit, market capitalization, dividends, preferred shares, foreign investors, shareholder returns, free cash flow, Q4 loss, long-term investment"
2024-02-27,"Samsung Electronics shows mixed signals: internal confidence marked by IR VP Daniel Oh’s first share purchase since 2022, despite stagnant stock around 70,000 KRW. Full divestment from ASML raises questions amid strong semiconductor demand and major R&D funding. Stock underperforms peers, while public interest grows, reflected in variety show references.","Samsung Electronics, Daniel Oh, Investor Relations, stock purchase, ASML divestment, EUV lithography, R&D investment, semiconductor demand, stock performance, Running Man, public interest"
2024-03-05,"Samsung Electronics trades around 70,000 KRW amid supply-demand imbalance from small investor selling, but rebound expected. Competitors like SK Hynix lead on AI semiconductor demand and HBM innovation with 36GB HBM3E chip. Foreign investors favor Samsung preferred shares due to improved shareholder returns and governance reforms, driving record Korean market inflows despite domestic capital outflows.","Samsung Electronics, stock price, trading range, small investors, supply-demand, AI semiconductor, HBM, HBM3E, SK Hynix, foreign investor net buying, preferred shares, shareholder returns, dividend increase, governance reform, Korea Discount, semiconductor recovery, Korean market, hedge funds"
2024-03-12,"Samsung Electronics lagged in the AI semiconductor rally, losing market share and posting losses due to weaker HBM and foundry positions. Despite significant KOSPI market cap drop, analysts are optimistic about recovery through 5th-gen HBM mass production, capacity expansion, and AI chip investments, pending improved yield and efficiency.","Samsung Electronics, HBM, AI semiconductors, stock decline, KOSPI, market capitalization, foundry, SK Hynix, TSMC, NVIDIA, memory chips, profitability outlook, AGI Computing Lab, production efficiency, semiconductor market"
2024-03-19,"Samsung Electronics ([005930]) remains Korea’s most held stock despite 1.16M individual investors exiting amid low 70,000 KRW range prices. Analysts optimistic on Q1 earnings, DRAM/NAND rebound, Galaxy S24, and HBM launches, forecasting up to 5.5T KRW operating profit and 90,000-100,000 KRW target. Institutional and foreign investors maintain diverse portfolios; corporate reforms and US-China semiconductor dynamics seen as growth drivers.","Samsung Electronics, 005930, shareholder decline, stock forecast, DRAM, NAND, HBM, Galaxy S24, Q1 earnings, US subsidy, corporate reform, inheritance tax, KOSPI, Chesley Investment, Park Seik, semiconductor recovery, TSMC risk, Texas fab, investor sentiment, foreign investment"
2024-03-26,"Samsung Electronics stock surged near 80,000 KRW driven by AI semiconductor demand and positive Nvidia CEO Jensen Huang’s remarks on HBM testing. Foreign and institutional buying lifted KOSPI, supported by insider buying from executive Jang Se-myung. Samsung plans AI accelerator chip ‘Maha1’ aiming for semiconductor leadership. Analysts raised targets to mid-90,000s–100,000+ KRW amid earnings and AI orders. Market optimism cautious on Nvidia partnership and demand sustainability.","Samsung Electronics, stock surge, 80,000 KRW, AI semiconductor, Nvidia, Jensen Huang, HBM, insider buying, Jang Se-myung, foreign investors, institutional investors, Maha1, KOSPI, price targets, earnings forecast, semiconductor leadership, investor sentiment"
2024-04-02,"Samsung Electronics stock rallies above 85,000 KRW driven by strong foreign net buying totaling ~10 trillion KRW since late 2023, pushing foreign ownership above 55%. Optimism on Q1 2025 semiconductor earnings and AI-related products like HBM fuels momentum, with target prices raised up to 107,000 KRW. Domestic retail investors take profits amid broader tech and auto stock interest.","Samsung Electronics, foreign net buying, 85,000 KRW, 10 trillion KRW purchases, foreign ownership 55%, Q1 2025 earnings, semiconductor rebound, HBM, AI chips, target price 107,000 KRW, stock rally, KOSPI, retail investors"
2024-04-09,"Samsung Electronics stock surpasses 85,000 KRW with target prices raised to 110,000 KRW, driven by a 931% YoY Q1 operating profit surge, rising DRAM and NAND prices, foreign investor buying, and HBM3E progress endorsed by Nvidia CEO. Foundry business expected profitable in Q3 with upside from Mach-1 AGI chip. Risks include U.S.-China tensions, high U.S. costs, and Q2 growth moderation.","Samsung Electronics, earnings surprise, operating profit, DRAM, NAND, HBM3E, Nvidia, foreign investors, target price 110,000 KRW, foundry profitability, Mach-1 AGI chip, U.S.-China export tensions, Q2 growth, AI chip demand"
2024-04-16,"Samsung Electronics shows strong long-term investment value with higher returns for long-term holders and large-scale holdings. Despite recent declines due to geopolitical risks, analysts maintain Buy ratings with 106,000-110,000 KRW targets. Growth driven by AI memory products (HBM3, HBM3E), certification and supply ramp-up, and improving DRAM market. Valuation discounted vs peers, with potential upside from AI semiconductor demand.","Samsung Electronics, long-term investment, stock returns, large-scale holdings, geopolitical risk, AI semiconductor, HBM3, HBM3E, DRAM, stock valuation, Buy rating, target price, Nvidia, market outlook"
2024-04-23,"Samsung Electronics benefits from memory semiconductor recovery, strong AI demand, and foreign investment, with Chairman Lee Jae-yong becoming Korea’s richest person amid stock surge. Analysts raised target price to ~110,000 KRW, driven by NAND, DRAM recovery, and AI semiconductor growth. Foreign holdings highest in 3 years, supported by Korea’s semiconductor ecosystem and government backing.","Samsung Electronics, Lee Jae-yong, memory semiconductor recovery, AI demand, Galaxy S24, 110,000 KRW target price, NAND, DRAM, foreign investment, semiconductor market, AI semiconductor, stock surge, valuation discount, Korean semiconductor hub, investment banks"
2024-04-30,"Samsung Electronics posted strong Q1 2025 results with operating profit soaring over 900% YoY to about 6.6 trillion KRW, driven by profitable semiconductor division and high-value memory products like HBM3E, DDR5, and SSDs. Growth supported by Galaxy S24 sales and AI data center demand. Despite initial stock price drop due to interest rate concerns and competition, Samsung shows recovery. Challenges include delayed tech commercialization, saturated smartphone market, and competition from SK Hynix's early AI-driven HBM investments and Chinese manufacturers.","Samsung Electronics, Q1 2025 earnings, operating profit surge, semiconductor profitability, HBM3E, DDR5, SSD, Galaxy S24, AI demand, stock volatility, SK Hynix competition, technology commercialization delay, smartphone saturation, China competition"
2024-05-07,"Samsung Electronics shows solid semiconductor earnings growth and strong Q1 results, driven by better-than-expected DRAM prices and NAND inventory recovery. The company’s new 5th-generation high-bandwidth memory (HBM3E) is set for mass production in Q2 with shipments rising in Q3. Despite sideways stock price movement around 70,000 KRW, analysts remain optimistic due to improving market conditions and attractive valuation among AI-related stocks. Samsung’s leadership position faces increased competition from SK Hynix in memory profitability, though Samsung maintains steady revenue and profit growth. Additionally, Samsung’s key shareholder Hong Ra-hee has restructured stock-backed loans by reducing collateral shares amid rising share prices, supporting financial stability within the Samsung family.","Samsung Electronics, semiconductor, DRAM, NAND, HBM3E, Q1 earnings, stock price, loan restructuring, collateral shares, inheritance tax, market outlook, AI, revenue growth, profit growth, stock valuation, Samsung family"
2024-05-14,"Samsung Electronics is refocusing R&D from autonomous driving software toward robotics, emphasizing humanoid robots and future robotics via its SAIT division. The AI companion robot “Ballie,” featured at CES 2024 with voice-controlled mobility and smart home integration, aims for commercial launch within the year. This effort will enhance synergy with Samsung Research’s robotics center, supported by new hires in autonomous robot intelligence. Competitors including Apple, LG Electronics, and Tesla (with its humanoid robot “Optimus”) are also advancing in the home robot market, reflecting growing momentum in Korea’s robotics industry encompassing components, motion control, and smart automation.","Samsung Electronics, robotics, SAIT, Ballie, AI companion robot, CES 2024, humanoid robot, smart home integration, Samsung Research, autonomous robot intelligence, Apple, LG Electronics, Tesla Optimus, Korean robotics companies, home robot market"
2024-05-21,"Samsung Electronics’ stock has underperformed compared to global semiconductor peers and domestic competitor SK Hynix over the past year, impacted by its conglomerate structure, slower semiconductor growth, and unresolved HBM quality issues with Nvidia. While Samsung leads globally in memory chips and other sectors, concerns remain about its competitiveness in AI semiconductors and memory tech. SK Hynix’s strong HBM profitability and Nvidia partnership have widened the market cap gap. To boost its stock, Samsung must prove HBM performance and innovate amid fierce competition from TSMC, SK Hynix, and others. Foreign investor activity, stock volatility, and conglomerate valuation complexities further influence market dynamics.","Samsung Electronics, stock performance, semiconductor, HBM, Nvidia, SK Hynix, market capitalization gap, conglomerate, memory chips, AI semiconductor, investor concerns, growth prospects, innovation, stock volatility, foreign investors, valuation"
2024-05-28,"Samsung Electronics faces stock stagnation despite semiconductor market recovery, while competitor SK Hynix benefits from strong AI memory (HBM) performance. Samsung’s delayed HBM investment and recent Nvidia testing failure have hurt its reputation. Conservative leadership changes and Chairman Lee Jae-yong’s legal issues raise concerns, along with lack of stock-based executive compensation, suggesting misaligned management incentives. Structural reforms including leadership overhaul and better executive-shareholder alignment are recommended to improve competitiveness and investor confidence.","Samsung Electronics, stock stagnation, HBM, Nvidia, SK Hynix, AI memory, semiconductor market, leadership change, Lee Jae-yong, innovation delay, legal issues, executive compensation, agency problem, shareholder alignment, governance structure, performance bonus"
2024-06-03,"Samsung Electronics’ stock faced downward pressure and short-term rebounds due to foreign investor sell-offs after the stock dropped below their average purchase price, alongside concerns about AI semiconductor competitiveness, NVIDIA HBM supply exclusion, and labor unrest. The stock recovered after NVIDIA CEO Jensen Huang clarified Samsung’s HBM was still under evaluation and had not failed testing, suggesting potential future supply alongside SK Hynix and Micron. Analysts remain cautiously optimistic, anticipating HBM3E sales growth and stronger memory market participation.","Samsung Electronics, Foreign Investors, Stock Decline, Stock Rise, HBM, NVIDIA, Jensen Huang, HBM Validation, HBM3E, Quality Testing, SK Hynix, Micron, Memory Supply Chain, AI Semiconductor, Supply Timeline, Investor Sentiment, Union Strike, Semiconductor Testing, Q2 Sales Forecast, Target Price 105,000 KRW, Investment Loss, Foreign Ownership Decline, Earnings Forecast 39 Trillion KRW, Test Rumors Rebuttal, Supply Competition, Engineering Process, Computex"
2024-06-10,"Samsung Electronics’ stock performance was affected by foreign investor activity, HBM segment developments, and executive changes. Initial sell-offs and concerns about exclusion from Nvidia’s supply chain pressured shares, but reassurance from Nvidia’s CEO and expected HBM3E demand spurred short-term recovery. Investor interest shifted to overseas stocks, with Samsung losing favor among minor accounts. Executive Kyung Kye-hyun’s resignation sparked speculation but was procedural. Analysts remain cautiously optimistic, highlighting growth in HBM3E and memory demand, with earnings and price targets reflecting long-term confidence.","Samsung Electronics, HBM3E, high-bandwidth memory, NVIDIA, SK Hynix, Micron, foreign investors, stock performance, investor sentiment, memory market, DRAM, Kyung Kye-hyun, executive changes, SAIT, Bernstein, target price, semiconductor, AI, TSMC, CoWoS, stock gifting, minor accounts, overseas investment"
2024-06-17,"Samsung Electronics’ stock showed recent volatility, recovering above 80,000 KRW but also dipping near 78,800 KRW. Despite trailing SK Hynix in AI-driven HBM development and foundry services, Samsung is in key HBM certification stages for Nvidia products. Brokerages hold bullish views with target prices above 100,000 KRW, backed by improving memory market conditions and steady foreign buying. Samsung is seen as significantly undervalued against global peers, with strong operating profit potential and benefits from Korean government efforts to enhance corporate governance and reduce the 'Korea discount'.","Samsung Electronics, stock price, 80,000 KRW, AI semiconductor, high-bandwidth memory, HBM certification, Nvidia, SK Hynix, target price, foreign investors, operating profit, undervaluation, corporate governance, Korea discount, memory market, semiconductor industry"
2024-06-24,"Samsung Electronics’ stock shows gradual recovery from market cap lows, driven by improving memory chip prices and anticipated HBM approval for Nvidia shipments. Foreign investors are net buyers, while domestic individual investors have recently sold. Semiconductor executives increasing holdings signal internal confidence. Persistent insider selling by Samsung special accounts and family members raises concerns over information asymmetry. Samsung remains undervalued relative to peers like Nvidia, fueled by AI chip growth. Analysts stay bullish with a 120,000 KRW target, noting risks from slower AI chip advances and competition.","Samsung Electronics, stock recovery, High Bandwidth Memory, HBM approval, Nvidia, foreign investors, individual investors, semiconductor executives, insider selling, special account, memory chip price, undervaluation, AI semiconductor, stock target price 120,000 KRW, information asymmetry, market outlook, Lee Jae-yong, inheritance tax sales"
2024-06-27,"Samsung Electronics is attracting strong investor interest on expectations of robust Q2 2024 earnings and memory market recovery. Despite slower HBM supply to Nvidia than SK Hynix, Samsung’s low valuation and rising server DRAM/NAND prices have driven foreign buying. Analysts raised Q2 operating profit forecasts by over 20%, with Q3 earnings expected to grow further, supported by AI demand. Optimism fuels expectations of a summer KOSPI rally. Investors cautioned about scams involving false insider info and special share sales.","Samsung Electronics, Q2 2024 earnings, foreign investors, HBM supply, Nvidia, SK Hynix, memory semiconductors, AI demand, DRAM price increase, NAND flash, operating profit forecast, KOSPI, summer rally, investment fraud, share sale scam"
2024-07-04,"Samsung Electronics delivered a strong Q2 earnings beat with operating profit exceeding 10 trillion KRW, driven by rising DRAM and NAND prices amid AI demand surge. Stock hit nearly 3.5-year high supported by robust foreign and institutional buying. Key growth drivers include expected HBM supply to Nvidia, with HBM3E nearing qualification, and a bullish memory market outlook. Analysts raised target prices up to 120,000 KRW, optimistic if Samsung secures Nvidia orders and sustains memory upcycle. Concerns remain on long-term competitiveness due to shrinking market share against SK Hynix (memory) and TSMC (foundry). Upcoming HBM deal, foundry turnaround, new products, and macro factors critical for future performance.","Samsung Electronics, Q2 earnings, operating profit, DRAM, NAND, AI demand, High Bandwidth Memory, HBM3E, Nvidia, memory market, stock price, foreign investors, institutional buying, analyst target price, semiconductor market share, SK Hynix, TSMC, foundry business, market competitiveness, memory upcycle, HBM qualification, 2024 outlook"
2024-07-11,"Samsung Electronics’ stock showed modest ~6% YTD gain, lagging behind US tech giants like Nvidia and Apple. Despite this, Samsung remains a key KOSPI driver, where an 18% share price rise could push the index past 3,000 points. Samsung family, especially the three daughters, sold over 3 trillion KRW in affiliate shares over 18 months mainly for inheritance tax payments, while Chairman Lee Jae-yong retained shares to maintain control. This illustrates strategic family financial planning and Samsung’s market importance.","Samsung Electronics, Samsung family, Lee Jae-yong, share sales, inheritance tax, KOSPI, stock performance, market driver, affiliate shares, inheritance planning"
2024-07-18,"Samsung Electronics’ stock price declined due to foreign and institutional selling amid labor strikes, wage talks, and U.S. election-related geopolitical uncertainties. Analysts remain optimistic on semiconductor demand driven by AI. Samsung family manages large inheritance tax, selling over 3.3 trillion KRW shares mainly by Hong Ra-hee and daughters; Chairman Lee Jae-yong retains shares, paying taxes via dividends and loans to maintain control. These moves reflect succession planning and tax obligations.","Samsung Electronics, stock decline, inheritance tax, Hong Ra-hee, Lee Boo-jin, Lee Seo-hyun, Lee Jae-yong, share sales, dividends, credit loans, labor strikes, wage negotiations, U.S. presidential election, semiconductor demand, AI cycle, investor sentiment, succession planning"
2024-07-25,"Samsung Electronics strengthens semiconductor position by launching 5th-gen HBM3E in Q3 2024, challenging SK Hynix amid AI demand. Q2 earnings strong with 28.56 trillion KRW sales and 6.45 trillion KRW operating profit, driven by DRAM and NAND price rises. Foreign investors heavily buying Samsung stocks, boosting ETFs and causing capital shift from smaller stocks. Quarterly dividend of 361 KRW per share declared for Q2 2024, totaling ~2.45 trillion KRW, payment on August 20, 2024. Strong financials and investor interest support positive near-term outlook.","Samsung Electronics, HBM3E, 5th-gen high-bandwidth memory, semiconductor, AI demand, Q2 earnings, DRAM, NAND, operating profit, foreign investor buying, Samsung ETF, stock inflows, dividend, Q2 2024, payout date August 20"
2024-08-01,"Samsung Electronics experienced a sharp >10% price drop in early May due to massive foreign selling amid US recession fears and semiconductor weakness. Analysts view this as an overreaction, citing strong fundamentals and HBM business growth. KB Securities sets a target price of 130,000 KRW based on 2025 earnings forecasts, expecting profit rebound supported by individual buying and improving outlook. Historical patterns suggest near-term recovery despite volatility.","Samsung Electronics, stock price drop, foreign investor selling, US recession fears, semiconductor weakness, HBM growth, KB Securities, target price 130,000 KRW, 2025 earnings forecast, individual investor buying, Nvidia, AMD, market volatility, profit recovery"
2024-08-08,"Samsung Electronics saw a decline of about 1.4 million small shareholders over the past year due to weak stock performance and individual net selling. Despite competition from SK Hynix in the HBM market, optimism remains with upcoming mass production of 5th-gen HBM3E chips, strong AI demand, and legacy memory supply shortages. Valuation is historically low, supporting positive earnings outlook amid mixed sentiment.","Samsung Electronics, small shareholder decline, individual investor net selling, 5th-generation HBM3E, SK Hynix competition, AI chip demand, memory shortage, low valuation, earnings outlook"
2024-08-15,"Samsung Electronics stock showed volatility: foreign investors bought strongly early July lifting price above 80,000 KRW, then took profits causing dips. Retail and small shareholders declined over past year. Despite short-term AI profitability concerns, mid- to long-term outlook positive with strong AI memory demand and undervaluation relative to earnings.","Samsung Electronics, stock volatility, foreign investor net buying and profit-taking, retail investor decline, AI memory demand, undervaluation, mid-to-long-term outlook"
2024-08-22,"Samsung Electronics saw decline in small retail investors amid prolonged price stagnation and outflows to US stocks, driven by stronger AI semiconductor growth abroad and Samsung’s weaker relative performance. Despite dips, some see undervaluation with semiconductor cycle continuation and earnings improvement expected. Stock influenced by Nvidia and AI market outlook.","Samsung Electronics, retail investor decline, stock stagnation, outflows to US stocks, AI semiconductor growth, earnings outlook, semiconductor cycle, Nvidia impact, undervaluation"
2024-08-29,"Samsung Electronics stock declined over 10% in August due to large foreign and institutional sell-offs totaling 2.9 trillion KRW, despite strong Q2 earnings. Retail investors bought aggressively but concerns over financial investment income tax, semiconductor uncertainty, and delayed AI revenue weighed on sentiment. Foreign funds shifted away from semiconductors as riskier short-term investments.","Samsung Electronics, stock decline, foreign and institutional selling, retail buying, Q2 earnings, investment income tax concerns, semiconductor uncertainty, delayed AI revenue, Nvidia earnings concerns"
